<?xml version="1.0" encoding="UTF-8" ?>

<devices xmlns="http://www.example.org/Comps"
        xmlns:xsi="http://www.w3.org/2001/XMLSchema-instance"
        xsi:schemaLocation="http://www.example.org/stamps comps.xsd">

   <device name="powerPack" origin="China">
       <price>50</price>
       <type>
           <location>Local</location>
           <powerConsum>600</powerConsum>
           <cooler>True</cooler>
           <port>No</port>
       </type>
       <critical>True</critical>
   </device>
    <device name="monitor" origin="China">
        <price>350</price>
        <type>
            <location>Perefirial</location>
            <powerConsum>75</powerConsum>
            <cooler>False</cooler>
            <port>VGA</port>
        </type>
        <critical>False</critical>
    </device>



</devices>